{
  "$schema": "https://json-schema.org/draft/2020-12/schema",
  "$id": "urn:areneon:schema:contracts:v1:team-dataset-manifest",
  "title": "TeamDatasetManifest",
  "description": "One generation run (ADR-013 section 4): the commits and hashes it ran under, its public keys, the pilot counts and quota plan, the draw budget and the logs. It is a data record: a reader recomputes nothing here but checks that the cells and splits are sorted and unique and that each split's team count equals its cells' quotas (the contract profile cannot sum). Its RFC 8785 SHA-256 is the dataset hash a snapshot lists.",
  "type": "object",
  "additionalProperties": false,
  "required": [
    "schema_version",
    "data_class",
    "dataset_id",
    "plan_id",
    "generator",
    "key",
    "d_max",
    "pilot_draws",
    "splits",
    "reference_pool_hash",
    "rejection_log"
  ],
  "properties": {
    "schema_version": {
      "const": 1
    },
    "data_class": {
      "description": "Always synthetic: a team in this system is generated from the pinned engine's data and a recorded seed, never a real team (ADR-013, ADR-008 section 5). The data-class guard refuses a record of this shape without it.",
      "const": "synthetic"
    },
    "dataset_id": {
      "description": "A name for the run, unique among datasets.",
      "type": "string",
      "pattern": "^[A-Za-z0-9][A-Za-z0-9._:-]{0,127}$"
    },
    "plan_id": {
      "description": "The plan whose stream the draws came from; a re-plan gets a fresh id.",
      "type": "string",
      "pattern": "^[A-Za-z0-9][A-Za-z0-9._:-]{0,127}$"
    },
    "generator": {
      "description": "What the run was made with.",
      "type": "object",
      "additionalProperties": false,
      "required": [
        "generator_commit",
        "config_hash",
        "label_set_hash",
        "vocabulary_hash",
        "manifest"
      ],
      "properties": {
        "generator_commit": {
          "description": "The git commit of the generator.",
          "type": "string",
          "pattern": "^[0-9a-f]{40}$"
        },
        "config_hash": {
          "description": "SHA-256 of the JCS bytes of the TeamGeneratorConfig.",
          "type": "string",
          "pattern": "^[0-9a-f]{64}$"
        },
        "label_set_hash": {
          "description": "SHA-256 of the JCS bytes of the TeamLabelSet.",
          "type": "string",
          "pattern": "^[0-9a-f]{64}$"
        },
        "vocabulary_hash": {
          "description": "SHA-256 of the JCS bytes of the TeamVocabulary.",
          "type": "string",
          "pattern": "^[0-9a-f]{64}$"
        },
        "manifest": {
          "$ref": "#/$defs/VersionManifest"
        }
      }
    },
    "key": {
      "$ref": "#/$defs/PublicKey"
    },
    "d_max": {
      "description": "D_max: the draw budget of the plan.",
      "type": "integer",
      "minimum": 1,
      "maximum": 9007199254740991
    },
    "pilot_draws": {
      "description": "The draws of the recorded pilot.",
      "type": "integer",
      "minimum": 1,
      "maximum": 9007199254740991
    },
    "splits": {
      "description": "The quota plan per split, sorted by split (dev, validation, training), unique.",
      "type": "array",
      "maxItems": 3,
      "items": {
        "$ref": "#/$defs/SplitPlan"
      },
      "minItems": 1
    },
    "merged_cells": {
      "description": "The D20 cell merge (ADR-010 E1) that was applied before generation: which base label cells were merged into one stratum. A base cell is one combination of label values, numbered by reading the position of each label's value in its listed values (the default last) as a mixed-radix number, the first label of the label set most significant. A merged stratum takes the number of its lowest member. Only merged strata are listed, sorted by stratum; every other base cell is its own stratum, and a manifest without this list merged nothing. The reader checks that members are ascending, unique and disjoint across strata, that the stratum is its first member, and that no cell of a split is a member of a merged stratum without being that stratum.",
      "type": "array",
      "maxItems": 65536,
      "items": {
        "description": "One merged stratum and its members.",
        "type": "object",
        "additionalProperties": false,
        "required": [
          "stratum",
          "cells"
        ],
        "properties": {
          "stratum": {
            "description": "The merged stratum's number: its lowest member.",
            "type": "integer",
            "minimum": 0,
            "maximum": 65535
          },
          "cells": {
            "description": "The base cell numbers merged into the stratum, ascending and unique.",
            "type": "array",
            "minItems": 2,
            "maxItems": 65536,
            "items": {
              "description": "A base cell number.",
              "type": "integer",
              "minimum": 0,
              "maximum": 65535
            }
          }
        }
      }
    },
    "reference_pool_hash": {
      "description": "SHA-256 of the sorted canonical team hashes of every earlier released dataset the run deduplicated against.",
      "type": "string",
      "pattern": "^[0-9a-f]{64}$"
    },
    "rejection_log": {
      "description": "The log of rejected, duplicate and overflow draws, by reference.",
      "type": "object",
      "additionalProperties": false,
      "required": [
        "log_sha256",
        "draws",
        "rejections",
        "duplicates",
        "overflows"
      ],
      "properties": {
        "log_sha256": {
          "description": "SHA-256 of the log file.",
          "type": "string",
          "pattern": "^[0-9a-f]{64}$"
        },
        "draws": {
          "description": "Draws made until every bin was full or D_max.",
          "type": "integer",
          "minimum": 0,
          "maximum": 9007199254740991
        },
        "rejections": {
          "description": "Draws the validator or the round trip refused.",
          "type": "integer",
          "minimum": 0,
          "maximum": 9007199254740991
        },
        "duplicates": {
          "description": "Candidates skipped as duplicates.",
          "type": "integer",
          "minimum": 0,
          "maximum": 9007199254740991
        },
        "overflows": {
          "description": "Candidates for a bin that was already full.",
          "type": "integer",
          "minimum": 0,
          "maximum": 9007199254740991
        }
      }
    }
  },
  "$defs": {
    "VersionManifest": {
      "description": "Replay identity of a battle (ADR-003, ADR-007): the pinned engine commit, the format, and the hashes of the engine ruleset and of Areneon's own format rules.",
      "type": "object",
      "additionalProperties": false,
      "required": [
        "showdown_commit",
        "format_id",
        "regulation",
        "ruleset_hash",
        "format_rules_hash"
      ],
      "properties": {
        "showdown_commit": {
          "description": "The pinned engine commit.",
          "type": "string",
          "pattern": "^[0-9a-f]{40}$"
        },
        "format_id": {
          "type": "string",
          "pattern": "^[a-z0-9]+$"
        },
        "regulation": {
          "type": "string",
          "minLength": 1
        },
        "ruleset_hash": {
          "description": "SHA-256 of the canonical engine ruleset.",
          "type": "string",
          "pattern": "^[0-9a-f]{64}$"
        },
        "format_rules_hash": {
          "description": "SHA-256 of Areneon's format rules record (ADR-007).",
          "type": "string",
          "pattern": "^[0-9a-f]{64}$"
        }
      }
    },
    "PublicKey": {
      "description": "The public generation keys. Only a public key may be written to a manifest: a sealed set's key lives in the isolated evaluation store and has no branch here.",
      "type": "object",
      "additionalProperties": false,
      "required": [
        "kind",
        "generation_key",
        "assignment_key"
      ],
      "properties": {
        "kind": {
          "const": "public"
        },
        "generation_key": {
          "description": "The HMAC key of the draw stream, as hex (public, so any holder can re-derive the stream).",
          "type": "string",
          "pattern": "^[0-9a-f]{64}$"
        },
        "assignment_key": {
          "description": "The HMAC key that orders each cell when splits are assigned, as hex (public).",
          "type": "string",
          "pattern": "^[0-9a-f]{64}$"
        }
      }
    },
    "SplitPlan": {
      "description": "The cells of one split, their pilot counts and quotas.",
      "type": "object",
      "additionalProperties": false,
      "required": [
        "split",
        "teams",
        "cells"
      ],
      "properties": {
        "split": {
          "description": "The split a team belongs to. Sealed teams live only in the isolated evaluation store and have no public split.",
          "enum": [
            "dev",
            "validation",
            "training"
          ]
        },
        "teams": {
          "description": "The split's team count: the sum of its cells' quotas.",
          "type": "integer",
          "minimum": 0,
          "maximum": 9007199254740991
        },
        "cells": {
          "description": "The cells after the D20 merge, sorted by stratum, unique.",
          "type": "array",
          "maxItems": 65536,
          "items": {
            "description": "One cell's pilot count and quota.",
            "type": "object",
            "additionalProperties": false,
            "required": [
              "stratum",
              "pilot_hits",
              "quota"
            ],
            "properties": {
              "stratum": {
                "description": "A merged label cell (stratum) id.",
                "type": "integer",
                "minimum": 0,
                "maximum": 65535
              },
              "pilot_hits": {
                "description": "Pilot draws that landed in the cell.",
                "type": "integer",
                "minimum": 0,
                "maximum": 9007199254740991
              },
              "quota": {
                "description": "Teams the cell gets in this split.",
                "type": "integer",
                "minimum": 0,
                "maximum": 9007199254740991
              }
            }
          },
          "minItems": 1
        }
      }
    }
  }
}
